{"$schema":"https://json-schema.org/draft/2020-12/schema","type":"object","additionalProperties":false,"required":["schemaVersion","contentVersion","id","type","videoId","url","officialTitle","author","language","attribution"],"properties":{"schemaVersion":{"const":"1.0.0"},"contentVersion":{"type":"integer","minimum":1},"id":{"type":"string","pattern":"^youtube:[A-Za-z0-9_-]{11}$"},"type":{"const":"youtube"},"videoId":{"type":"string","pattern":"^[A-Za-z0-9_-]{11}$"},"url":{"type":"string","format":"uri"},"officialTitle":{"type":"string","minLength":1},"author":{"type":"object","additionalProperties":false,"required":["name","url"],"properties":{"name":{"type":"string","minLength":1},"url":{"type":"string","format":"uri"}}},"language":{"type":"string","minLength":2},"attribution":{"type":"object","required":["text"],"properties":{"text":{"type":"string","minLength":1},"licenseUrl":{"type":"string","format":"uri"}}},"durationSeconds":{"type":"integer","minimum":1},"verifiedAt":{"type":"string","format":"date-time"}}}
