{
  "schemaVersion": "1.0.0",
  "contentVersion": 1,
  "id": "youtube:6h6306mA3bQ",
  "type": "youtube",
  "videoId": "6h6306mA3bQ",
  "url": "https://www.youtube.com/watch?v=6h6306mA3bQ",
  "officialTitle": "CLASE 2: Genera imágenes y vídeos profesionales y descubre el modelo de negocio del 2026",
  "author": {
    "name": "CenteIA Education",
    "url": "https://www.youtube.com/channel/UCsDXXCoXaS-wO1Wnnt_LM3A"
  },
  "language": "es",
  "attribution": {
    "text": "Todas las microlecciones proceden del video original de CenteIA Education. Consulta la fuente oficial para ver el contenido completo y apoyar al canal."
  }
}
