{
  "schemaVersion": "1.0.0",
  "contentVersion": 1,
  "id": "youtube:V60Xr0jbthE",
  "type": "youtube",
  "videoId": "V60Xr0jbthE",
  "url": "https://www.youtube.com/watch?v=V60Xr0jbthE",
  "officialTitle": "CLASE 4: El Paso a Paso para Convertirte en un Experto en IA Titulado",
  "author": {
    "name": "CenteIA Education",
    "url": "https://www.youtube.com/channel/UCsDXXCoXaS-wO1Wnnt_LM3A"
  },
  "language": "es",
  "attribution": {
    "text": "Contenido original de CenteIA Education en YouTube. La selección, organización y síntesis de las microlecciones corresponde a Microlearning Center."
  }
}
