{
  "schemaVersion": "1.0.0",
  "contentVersion": 1,
  "id": "youtube:2BoTWGq0vjY",
  "type": "youtube",
  "videoId": "2BoTWGq0vjY",
  "url": "https://www.youtube.com/watch?v=2BoTWGq0vjY",
  "officialTitle": "CLASE 3: Domina la habilidad más cotizada del mercado: Herramientas y Automatizaciones con IA",
  "author": {
    "name": "CenteIA Education",
    "url": "https://www.youtube.com/channel/UCsDXXCoXaS-wO1Wnnt_LM3A"
  },
  "language": "es",
  "attribution": {
    "text": "Contenido original de CenteIA Education en YouTube. La selección, organización y síntesis de las microlecciones corresponde a Microlearning Center."
  }
}
